{
  "production_package_id": "pp_a1b2c3d4e5f60708",
  "social_media_package_id": "sm_a1b2c3d4e5f60708",
  "status": "generated",
  "renderer": "templated",
  "platform": null,
  "design_id": "dc-002-v1",
  "template_id": "dc-carousel-v1",
  "slide_sequence": [
    {
      "slide_number": 1,
      "slide_role": "cover",
      "headline_mapping": "Why Local Businesses Need a Digital Marketing Strategy in 2026",
      "body_copy_mapping": "A coherent digital marketing strategy is no longer optional for local businesses.",
      "cta_mapping": null,
      "image_guidance_mapping": "Slide 1: a local storefront with a subtle digital overlay motif — illustrative guidance only, not a real creative brief [mock].",
      "placeholder_tag_mapping": {
        "headline": "Why Local Businesses Need a Digital Marketing Strategy in 2026",
        "body": "A coherent digital marketing strategy is no longer optional for local businesses.",
        "cta": null,
        "image_guidance": "Slide 1: a local storefront with a subtle digital overlay motif — illustrative guidance only, not a real creative brief [mock]."
      },
      "structured_content": {
        "statistic": null,
        "quote": null,
        "key_points": []
      }
    },
    {
      "slide_number": 2,
      "slide_role": "insight",
      "headline_mapping": "Search Visibility Matters",
      "body_copy_mapping": "Search visibility matters because most buying journeys begin with a search engine query.",
      "cta_mapping": null,
      "image_guidance_mapping": "Slide 2: a search results page with a highlighted local business listing — illustrative guidance only [mock].",
      "placeholder_tag_mapping": {
        "headline": "Search Visibility Matters",
        "body": "Search visibility matters because most buying journeys begin with a search engine query.",
        "cta": null,
        "image_guidance": "Slide 2: a search results page with a highlighted local business listing — illustrative guidance only [mock]."
      },
      "structured_content": {
        "statistic": null,
        "quote": null,
        "key_points": []
      }
    },
    {
      "slide_number": 3,
      "slide_role": "statistic",
      "headline_mapping": "Nearly 90% Start With Search",
      "body_copy_mapping": "Nearly 90% of local buying journeys begin with a search engine query before a purchase decision is made.",
      "cta_mapping": null,
      "image_guidance_mapping": "Slide 3: a bold percentage figure over a subtle search-bar motif — illustrative guidance only [mock].",
      "placeholder_tag_mapping": {
        "headline": "Nearly 90% Start With Search",
        "body": "Nearly 90% of local buying journeys begin with a search engine query before a purchase decision is made.",
        "cta": null,
        "image_guidance": "Slide 3: a bold percentage figure over a subtle search-bar motif — illustrative guidance only [mock]."
      },
      "structured_content": {
        "statistic": {
          "value": "90%",
          "context": "Nearly 90% of local buying journeys begin with a search engine query before a purchase decision is made."
        },
        "quote": null,
        "key_points": []
      }
    },
    {
      "slide_number": 4,
      "slide_role": "quote",
      "headline_mapping": "Social Proof Compounds Trust",
      "body_copy_mapping": "Social proof compounds trust in a way advertising alone cannot buy.",
      "cta_mapping": null,
      "image_guidance_mapping": "Slide 4: a customer leaving a five-star review on a phone — illustrative guidance only [mock].",
      "placeholder_tag_mapping": {
        "headline": "Social Proof Compounds Trust",
        "body": "Social proof compounds trust in a way advertising alone cannot buy.",
        "cta": null,
        "image_guidance": "Slide 4: a customer leaving a five-star review on a phone — illustrative guidance only [mock]."
      },
      "structured_content": {
        "statistic": null,
        "quote": {
          "quote_text": "Social proof compounds trust in a way advertising alone cannot buy."
        },
        "key_points": []
      }
    },
    {
      "slide_number": 5,
      "slide_role": "takeaway",
      "headline_mapping": "A Repeatable Three-Pillar System",
      "body_copy_mapping": "The reader adopts a structured, three-pillar approach to digital marketing.",
      "cta_mapping": null,
      "image_guidance_mapping": "Slide 5: three clean pillars labelled Search, Social, Content — illustrative guidance only [mock].",
      "placeholder_tag_mapping": {
        "headline": "A Repeatable Three-Pillar System",
        "body": "The reader adopts a structured, three-pillar approach to digital marketing.",
        "cta": null,
        "image_guidance": "Slide 5: three clean pillars labelled Search, Social, Content — illustrative guidance only [mock]."
      },
      "structured_content": {
        "statistic": null,
        "quote": null,
        "key_points": [
          "Search visibility matters because most buying journeys begin with a search engine query.",
          "Social proof compounds trust in a way advertising alone cannot buy.",
          "Content consistency is rewarded by both algorithms and audiences over time."
        ]
      }
    },
    {
      "slide_number": 6,
      "slide_role": "cta",
      "headline_mapping": "Learn More Today",
      "body_copy_mapping": "Learn more about building a digital marketing strategy",
      "cta_mapping": "Learn more about building a digital marketing strategy",
      "image_guidance_mapping": "Slide 6: a clear call-to-action button on a clean background — illustrative guidance only [mock].",
      "placeholder_tag_mapping": {
        "headline": "Learn More Today",
        "body": "Learn more about building a digital marketing strategy",
        "cta": "Learn more about building a digital marketing strategy",
        "image_guidance": "Slide 6: a clear call-to-action button on a clean background — illustrative guidance only [mock]."
      },
      "structured_content": {
        "statistic": null,
        "quote": null,
        "key_points": []
      }
    }
  ],
  "rendering_metadata": {
    "mapping_strategy": "semantic-six-template-v1",
    "slide_count": 6,
    "generator": "templated-renderer-adapter"
  },
  "validation_metadata": {
    "social_media_package_checksum": "d734fd7f65fce3498ee98ef948f538caa02346dfd80498b68b81776e522727c7",
    "all_slides_populated": true,
    "renderer_mapping_validated": true
  },
  "generated_at": "2026-08-07T12:00:00.000Z",
  "schema_version": "1.1",
  "production_checksum": "74ca8bb10c601884e7fffe44fce5fe3dde47bc77f6faaddf7b1a66fc7f48b46a"
}
